{
  "$schema": "https://json-schema.org/draft/2020-12/schema",
  "$id": "https://stonewright.dev/schemas/design-spec/1.0.0.json",
  "title": "Stonewright Design Spec",
  "description": "Renderer-agnostic page description used by Stonewright to materialize Gutenberg, Elementor V3, and Elementor V4 pages from a single source of truth.",
  "type": "object",
  "additionalProperties": false,
  "required": ["version", "sections"],
  "properties": {
    "version": {
      "type": "string",
      "const": "1.0.0"
    },
    "style_policy": {
      "type": "string",
      "enum": ["default", "strict", "pixel", "pixel-perfect"],
      "description": "When strict, decorative styles such as borders, radius, shadows, and filters require measured design provenance."
    },
    "source": {
      "type": "object",
      "description": "Where this spec came from. Optional but recommended for traceability.",
      "additionalProperties": false,
      "properties": {
        "type": {
          "type": "string",
          "enum": ["figma", "image", "html", "manual"]
        },
        "url": { "type": "string", "format": "uri" },
        "node_id": { "type": "string" },
        "captured_at": { "type": "string", "format": "date-time" }
      }
    },
    "page": {
      "type": "object",
      "additionalProperties": false,
      "properties": {
        "title": { "type": "string", "maxLength": 255 },
        "slug": { "type": "string", "maxLength": 200 },
        "template": { "type": "string" },
        "status": {
          "type": "string",
          "enum": ["draft", "publish", "private", "pending"]
        }
      }
    },
    "tokens": {
      "type": "object",
      "additionalProperties": false,
      "properties": {
        "colors": {
          "type": "object",
          "additionalProperties": {
            "type": "string",
            "pattern": "^(#|rgb|hsl|var\\().*"
          }
        },
        "typography": {
          "type": "object",
          "additionalProperties": {
            "type": "object",
            "additionalProperties": false,
            "properties": {
              "font_family": { "type": "string" },
              "font_weight": { "type": "string" },
              "font_size": { "type": "string" },
              "line_height": { "type": "string" },
              "letter_spacing": { "type": "string" }
            }
          }
        },
        "spacing": {
          "type": "object",
          "additionalProperties": { "type": "string" }
        },
        "radius": {
          "type": "object",
          "additionalProperties": { "type": "string" }
        },
        "shadow": {
          "type": "object",
          "additionalProperties": { "type": "string" }
        }
      }
    },
    "responsive": {
      "type": "object",
      "additionalProperties": false,
      "properties": {
        "breakpoints": {
          "type": "object",
          "additionalProperties": false,
          "properties": {
            "mobile": { "type": "integer", "minimum": 0 },
            "tablet": { "type": "integer", "minimum": 0 },
            "desktop": { "type": "integer", "minimum": 0 }
          }
        }
      }
    },
    "breakpoints": {
      "type": "array",
      "items": {
        "type": "object",
        "additionalProperties": true,
        "required": ["id"],
        "properties": {
          "id": { "type": "string" },
          "label": { "type": "string" },
          "maxWidth": { "type": "integer", "minimum": 0 }
        }
      }
    },
    "assets": {
      "type": "array",
      "items": {
        "type": "object",
        "additionalProperties": false,
        "required": ["id", "url"],
        "properties": {
          "id": { "type": "string" },
          "url": { "type": "string" },
          "attachment_id": { "type": "integer" },
          "altText": { "type": "string" },
          "width": { "type": ["integer", "number"] },
          "height": { "type": ["integer", "number"] },
          "mimeType": { "type": "string" }
        }
      }
    },
    "meta": {
      "type": "object",
      "additionalProperties": true
    },
    "sections": {
      "type": "array",
      "minItems": 1,
      "items": { "$ref": "#/$defs/section" }
    }
  },
  "$defs": {
    "section": {
      "type": "object",
      "additionalProperties": false,
      "required": ["id", "blocks"],
      "properties": {
        "id": { "type": "string" },
        "role": {
          "type": "string",
          "enum": ["hero", "content", "cta", "footer", "pricing", "features", "testimonials", "gallery", "contact", "faq"]
        },
        "name": { "type": "string" },
        "width": {
          "type": "string",
          "enum": ["full", "boxed", "narrow"],
          "default": "boxed"
        },
        "layout": {
          "type": ["string", "object"],
          "description": "stack|row|grid (or legacy horizontal/vertical), or a desktop/tablet/mobile map of those intents."
        },
        "direction": {
          "type": ["string", "object"],
          "description": "Optional flex direction override; accepts row/column/horizontal/vertical or a viewport map."
        },
        "gap": { "type": ["string", "number"] },
        "padding": { "$ref": "#/$defs/dimensions" },
        "background": { "$ref": "#/$defs/background" },
        "fullWidth": { "type": "boolean" },
        "margin": { "type": "string" },
        "sticky": { "type": "string" },
        "sticky_on": {
          "type": "array",
          "items": { "type": "string", "enum": ["desktop", "tablet", "mobile"] }
        },
        "sticky_offset": { "type": ["integer", "number", "string"] },
        "z_index": { "type": ["integer", "number", "string"] },
        "hide_on": {
          "type": "array",
          "items": { "type": "string", "enum": ["desktop", "tablet", "mobile"] }
        },
        "css_classes": { "type": "string" },
        "justify_content": { "type": "string" },
        "align_items": { "type": "string" },
        "type": { "type": "string" },
        "blocks": {
          "type": "array",
          "items": { "$ref": "#/$defs/block" }
        }
      }
    },
    "block": {
      "type": "object",
      "additionalProperties": false,
      "required": ["type"],
      "properties": {
        "type": {
          "type": "string",
          "enum": [
            "heading",
            "paragraph",
            "image",
            "image-box",
            "button",
            "spacer",
            "separator",
            "divider",
            "list",
            "icon",
            "icon-box",
            "video",
            "embed",
            "slider",
            "slides",
            "card",
            "row",
            "column",
            "container",
            "text-editor",
            "image-gallery",
            "gallery",
            "countdown",
            "nav-menu",
            "icon-list",
            "social-icons",
            "tabs",
            "accordion",
            "toggle",
            "progress-bar",
            "counter",
            "testimonial",
            "testimonial-carousel",
            "reviews-carousel",
            "review-carousel",
            "carousel",
            "call-to-action",
            "cta",
            "chip-list",
            "pill-grid",
            "chips",
            "pills",
            "form",
            "form-placeholder"
          ]
        },
        "intent": { "type": "string" },
        "required_steps": {
          "type": "array",
          "items": { "type": "string" }
        },
        "text": { "type": "string" },
        "level": { "type": "integer", "minimum": 1, "maximum": 6 },
        "url": { "type": "string" },
        "poster": {
          "type": "object",
          "additionalProperties": true,
          "properties": {
            "url": { "type": "string" },
            "id": { "type": ["integer", "string"] },
            "alt": { "type": "string" }
          }
        },
        "autoplay": { "type": ["boolean", "string"] },
        "mute": { "type": ["boolean", "string"] },
        "loop": { "type": ["boolean", "string"] },
        "controls": { "type": ["boolean", "string"] },
        "aspect_ratio": { "type": "string" },
        "alt": { "type": "string" },
        "link": {
          "type": "object",
          "additionalProperties": true,
          "properties": {
            "url": { "type": "string" },
            "is_external": { "type": "boolean" },
            "nofollow": { "type": "boolean" }
          }
        },
        "caption": { "type": "string" },
        "title": { "type": "string" },
        "description": { "type": "string" },
        "id": { "type": ["integer", "string"] },
        "height": { "type": ["integer", "number", "string"] },
        "gap": { "type": ["string", "number"] },
        "padding": { "$ref": "#/$defs/dimensions" },
        "background": { "$ref": "#/$defs/background" },
        "items": { "type": "array" },
        "icons": { "type": "array" },
        "images": {
          "type": "array",
          "items": {
            "type": "object",
            "additionalProperties": true,
            "properties": {
              "id": { "type": ["integer", "string"] },
              "url": { "type": "string" },
              "src": { "type": "string" },
              "alt": { "type": "string" }
            }
          }
        },
        "menu": { "type": ["integer", "string", "null"] },
        "layout": { "type": ["string", "object"] },
        "direction": { "type": ["string", "object"] },
        "pointer": { "type": "string" },
        "justify_content": { "type": "string" },
        "align_items": { "type": "string" },
        "wrap": { "type": "string" },
        "columns": { "type": ["integer", "number", "string"] },
        "skin": { "type": "string" },
        "min_height": { "type": ["integer", "number", "string", "object"] },
        "border_radius": { "type": ["integer", "number", "string", "object"] },
        "overlay": { "type": "string" },
        "overlay_color": { "type": "string" },
        "vertical_position": { "type": "string" },
        "alignment": { "type": ["string", "object"] },
        "button_text": { "type": "string" },
        "button": { "type": ["string", "object"] },
        "image": {
          "type": "object",
          "additionalProperties": true,
          "properties": {
            "url": { "type": "string" },
            "id": { "type": ["integer", "string"] },
            "alt": { "type": "string" }
          }
        },
        "icon_position": { "type": "string" },
        "icon_spacing": { "type": ["integer", "number", "string", "object"] },
        "icon_indent": { "type": ["integer", "number", "string", "object"] },
        "selected_icon": { "type": ["string", "object"] },
        "testimonials": { "type": "array" },
        "reviews": { "type": "array" },
        "slides": { "type": "array" },
        "widget_type": { "type": "string" },
        "settings": { "type": "object", "additionalProperties": true },
        "fallback": { "type": "string" },
        "narrow": { "type": "string" },
        "image_size": { "type": "string" },
        "spacing": { "type": ["integer", "number", "string"] },
        "weight": { "type": ["integer", "number", "string", "object"] },
        "link_to": { "type": "string" },
        "open_lightbox": { "type": "string" },
        "orderby": { "type": "string" },
        "full_width": { "type": ["boolean", "string"] },
        "fullWidth": { "type": "boolean" },
        "sticky": { "type": "string" },
        "sticky_on": {
          "type": "array",
          "items": { "type": "string", "enum": ["desktop", "tablet", "mobile"] }
        },
        "sticky_offset": { "type": ["integer", "number", "string"] },
        "z_index": { "type": ["integer", "number", "string"] },
        "hide_on": {
          "type": "array",
          "items": { "type": "string", "enum": ["desktop", "tablet", "mobile"] }
        },
        "css_classes": { "type": "string" },
        "dropdown": { "type": "string" },
        "toggle": { "type": "string" },
        "toggle_align": { "type": "string" },
        "toggle_color": { "type": "string" },
        "size": { "type": "string" },
        "icon": { "type": ["string", "object"] },
        "color": { "type": "string" },
        "background_color": { "type": "string" },
        "external": { "type": "boolean" },
        "nofollow": { "type": "boolean" },
        "countdown_type": { "type": "string" },
        "due_date": { "type": "string" },
        "show": {
          "type": "object",
          "additionalProperties": true
        },
        "labels": {
          "type": "object",
          "additionalProperties": { "type": "string" }
        },
        "show_days": { "type": ["boolean", "string"] },
        "show_hours": { "type": ["boolean", "string"] },
        "show_minutes": { "type": ["boolean", "string"] },
        "show_seconds": { "type": ["boolean", "string"] },
        "label_days": { "type": "string" },
        "label_hours": { "type": "string" },
        "label_minutes": { "type": "string" },
        "label_seconds": { "type": "string" },
        "view": { "type": "string" },
        "link_click": { "type": "string" },
        "divider": { "type": ["boolean", "string"] },
        "shape": { "type": "string" },
        "align": { "type": "string" },
        "html": { "type": "string" },
        "library": { "type": "string" },
        "title_size": { "type": "string" },
        "icon_color": { "type": "string" },
        "divider_color": { "type": "string" },
        "starting_number": { "type": ["integer", "number", "string"] },
        "ending_number": { "type": ["integer", "number", "string"] },
        "from": { "type": ["integer", "number", "string"] },
        "to": { "type": ["integer", "number", "string"] },
        "duration": { "type": ["integer", "number", "string"] },
        "prefix": { "type": "string" },
        "suffix": { "type": "string" },
        "number_size": { "type": ["integer", "number", "string"] },
        "show_labels": { "type": ["boolean", "string"] },
        "custom_labels": { "type": ["boolean", "string"] },
        "expire_actions": {
          "type": "array",
          "items": { "type": "string" }
        },
        "expire_message": { "type": "string" },
        "expire_redirect_url": { "type": "string" },
        "blocks": {
          "type": "array",
          "items": { "$ref": "#/$defs/block" }
        },
        "style": {
          "type": "object",
          "additionalProperties": true
        },
        "style_source": {
          "type": "string",
          "description": "Source of measured style values, for example figma, screenshot, measured, explicit, or user."
        },
        "styles": {
          "type": "object",
          "additionalProperties": true
        },
        "typography": {
          "type": "object",
          "additionalProperties": true
        },
        "src": { "type": "string" },
        "assetRef": { "type": "string" },
        "width": { "type": ["integer", "number", "string"] },
        "form_name": { "type": "string" },
        "button_text": { "type": "string" },
        "field_style": {
          "type": "object",
          "additionalProperties": true
        },
        "button_style": {
          "type": "object",
          "additionalProperties": true
        },
        "submit_actions": {
          "type": "array",
          "items": { "type": "string" }
        },
        "fields": {
          "type": "array",
          "items": {
            "type": "object",
            "additionalProperties": false,
            "required": ["type", "label"],
            "properties": {
              "type": { "type": "string", "enum": ["text", "email", "select", "textarea", "tel", "checkbox", "radio"] },
              "label": { "type": "string" },
              "placeholder": { "type": "string" },
              "required": { "type": ["boolean", "string"] },
              "default": { "type": "string" }
            }
          }
        }
      }
    },
    "background": {
      "type": "object",
      "additionalProperties": false,
      "properties": {
        "color": { "type": "string" },
        "image": { "type": "string" },
        "imageRef": { "type": "string" },
        "image_id": { "type": "integer" },
        "overlay": { "type": "string" },
        "position": { "type": "string" },
        "size": { "type": "string" },
        "repeat": { "type": "string" }
      }
    },
    "dimensions": {
      "type": "object",
      "additionalProperties": false,
      "properties": {
        "top": { "type": ["integer", "string"] },
        "right": { "type": ["integer", "string"] },
        "bottom": { "type": ["integer", "string"] },
        "left": { "type": ["integer", "string"] }
      }
    }
  }
}
